24541780-1cd8-4c4b-a942-a85100ac605d,王政昊、张敏与王红涛民间借贷纠纷二审民事判决书,2,2017-12-12,二审,（2017）吉05民终1555号,,1,2017-12-22,None,None,665,吉林省通化市中级人民法院,吉林,通化市,,,,,,,2,,上诉人王政昊、张敏因与被上诉人王红涛民间借贷纠纷一案，不服吉林省通化市东昌区人民法院（2017）吉0502民初2132号民事判决，向本院提起上诉。本院于2017年10月30日立案后，依法组成合议庭进行了审理。本案现已审理终结,,,,吉林省通化市中级人民法院民 事 判 决 书（2017）吉05民终1555号上诉人（原审被告）：王政昊，男，1993年10月17日出生，汉族，现住吉林省榆树市。上诉人（原审被告）：张敏，女，1994年7月18日出生，汉族，现住吉林省吉林市昌邑区。上列二上诉人委托代理人：尹海燕，吉林崇旭律师事务所律师。被上诉人（原审原告）：王红涛，女，1981年7月5日出生，汉族，通化师范学院教师，现住吉林省通化市东昌区。上诉人王政昊、张敏因与被上诉人王红涛民间借贷纠纷一案，不服吉林省通化市东昌区人民法院（2017）吉0502民初2132号民事判决，向本院提起上诉。本院于2017年10月30日立案后，依法组成合议庭进行了审理。本案现已审理终结。王政昊、张敏上诉请求：1、请求改判王政昊、张敏不承担责任或发回重审。2、本案诉讼费由王红涛承担。上诉事实理由：王政昊、张敏系同学关系，王红涛与王政昊系师生关系。2015年，王红涛委托王政昊将其钱款贷给在校学生，即校园贷。王政昊受委托后，遂将王红涛的钱款贷给同学，期间多次给王红涛得利分红，后来因钱款没有收回，王红涛找到王政昊、张敏，以不给毕业材料相威胁，要求王政昊、张敏为其出具借条，王政昊、张敏出于无奈于2016年6月26日为王红涛出具借条。王红涛隐瞒事实起诉，原审法院未了解情况仅以欠条下判，属于事实不清。并且约定利息过高。王红涛答辩称，双方之间存在真实的借款关系，王红涛不存在胁迫王政昊、张敏的事实，原审判决正确。王红涛向一审法院起诉请求：1、判令王政昊、张敏立即偿还借款人民币135197元及利息，利息按法定24%年利率计算，自2015年11月5日起至全部还清所有债务；2、王红涛主张债权产生的燃油费、住宿费全部由王政昊、张敏负担；3、本案诉讼费用由王政昊、张敏承担。事实和理由：2015年11月5日，王政昊和张敏以从事个体经营，急需资金向王红涛借款80274元，张敏向王红涛出具借条80000元整。后王政昊、张敏多次向王红涛借款累计达266197元，期间王政昊、张敏偿还王红涛91000元，截止2016年6月26日，王政昊、张敏尚欠王红涛本金135197元整。当日王政昊向本人出具了175000元借条，并自愿给王红涛39803元利息作为补偿，连带责任人张敏签字，并承诺一个月还清所有债务。2017年2月27日王红涛及家属去王政昊户籍地吉林省榆树市，王政昊委托他人转给王红涛10000元利息作为补偿，并承诺3月5日再偿还本金30000元，但至今未给。一审法院认定事实：2015年张敏（甲方）与王红涛（乙方）签订借款协议，约定：甲方向乙方借款金额为80000元人民币，借款期限1个月，自2015年11月5日至2015年12月5日。自借款之日起，在合同期内，月利为10000元等。合同签订后，王红涛将其存有80274.95元的银行卡一张交给张敏。后王政昊、张敏又多次向王红涛借款，期间王政昊、张敏又偿还王红涛部分借款。2016年6月26日王红涛（甲方）与王政昊（乙方）、连带责任保证人张敏签订借款担保协议，约定：“甲方愿出借给乙方人民币175000元。借款日期自2015年11月5日至2016年7月26日。乙方偿还借款的顺序为先利息后本金。乙方应觅连带责任保证人壹名，确保本合同的履行。连带责任保证人愿与王政昊负连带返还本金和追讨该借款的差旅费、律师费、诉讼费等责任。甲乙双方及连带责任保证人在本合同上签字即表示充分理解并同意本合同的所有条款。”另查明，该协议中约定的175000元借款（含利息），本金实际为135197元。协议签订后，王政昊、张敏仅支付王红涛利息10000元，截止2016年6月26日，王政昊、张敏尚欠王红涛135197元，至今未付。一审法院认为，借款人应按合同约定全面履行自己的义务，在借款到期后，应按约定的期限返还借款给出借人。未按照约定的期限返还借款，应当继续履行合同，并按照约定或者国家有关规定支付逾期利息等，承担违约责任。王红涛与张敏、王政昊双方约定的利率过高，已超过年利率36%，超过部分的利息约定无效。对王红涛主张其借款利息按年利率24%计算，符合国家有关规定，该院应予支持。至于王政昊偿还的10000元是利息还是本金，因双方在协议中有约定偿还借款的顺序先利息后本金，故应认定该10000元为利息。王政昊、张敏承担利息的起算日期应从借款之日起开始计算至还清全部借款时止。王红涛主张去往王政昊家户籍所在地的燃油费、住宿费全部由王政昊补偿，因其既无具体请求数额，也未无相关证据证明，不予支持。王政昊主张王红涛让其帮助放贷等，未提供任何证据证明，不予支持。遂判决：一、王政昊立即偿还王红涛借款本金135197元及80000元的利息（自2015年11月5日起至2016年6月26日止）、135197元的利息（自2016年6月27日起至还清全部借款时止），利息均按年利率24%计算，扣除已偿还王红涛的10000元利息；张敏承担连带清偿责任。二、驳回王红涛的其他诉讼请求。本院二审期间审理查明事实与原审审理查明事实基本一致。本院认为，本案系民间借贷纠纷。王政昊、张敏主张其与王红涛之间系委托放贷关系。但其提供的证人证言仅能证明双方之间存在经济往来，无法证明双方之间存在委托关系。而王红涛提供的借据及支付宝往来能够证明王红涛与王政昊、张敏之间借贷关系的事实。张敏、王政昊主张借据系在王红涛胁迫下签订，但其未能提供证据证明王红涛胁迫张敏、王政昊的事实。从双方身份看，王红涛与张敏、王政昊虽系师生关系，但王红涛为普通专业课授课老师，与王政昊、张敏之间不存在管理与被管理关系，故王红涛不具备胁迫王政昊、张敏的客观条件。综上所述，王政昊、张敏的上诉理由不能成立，其上诉请求本院不予支持。一审判决认定事实清楚，适用法律正确。依照《中华人民共和国民事诉讼法》第一百七十条第一款第（一）项规定，判决如下：驳回上诉，维持原判。二审案件受理费4528元，由上诉人王政昊、张敏负担。本判决为终审判决。审判长　　吴兴彦审判员　　王立武审判员　　修　勇二〇一七年十二月十二日书记员　　撒　炜—2—,
70f23218-78d8-4c9d-b630-aa0a00f21105,曹娟娟与郑东民间借贷纠纷二审民事裁定书,2,2019-02-21,二审,（2019）吉02民终321号,,1,2019-03-08,None,None,642,吉林省吉林市中级人民法院,吉林,吉林市,,,,,,,2,,上诉人曹娟娟因与被上诉人郑东民间借贷纠纷一案，不服吉林高新技术产业开发区人民法院（2018）吉0291民初596号民事裁定，向本院提起上诉。本院于2019年1月29日立案后，依法组成合议庭审理了本案。上诉人曹娟娟的委托诉讼代理人张福生到庭参加了诉讼。本案现已审理终结,,,,吉林省吉林市中级人民法院民 事 裁 定 书（2019）吉02民终321号上诉人（原审原告）：曹娟娟，女，1989年1月23日出生，满族，无职业，住吉林省吉林市丰满区。委托诉讼代理人：张福生，吉林远耀律师事务所律师。被上诉人（原审被告）：郑东，女，1995年2月8日出生，汉族，住吉林省镇赉县。上诉人曹娟娟因与被上诉人郑东民间借贷纠纷一案，不服吉林高新技术产业开发区人民法院（2018）吉0291民初596号民事裁定，向本院提起上诉。本院于2019年1月29日立案后，依法组成合议庭审理了本案。上诉人曹娟娟的委托诉讼代理人张福生到庭参加了诉讼。本案现已审理终结。曹娟娟上诉请求：撤销一审裁定，改判支持曹娟娟的诉讼请求。事实和理由：一审裁定认定事实、适用法律均存在错误。一、一审裁定采信李辰宇、王硕、刘成博庭审“既不认识也从未见过曹娟娟，更未就借款事宜与曹娟娟进行协议”的陈述错误。王硕案件中，王硕提交其转入曹娟娟账户4笔款项共4700元，转入潘海峰账户1笔1600元的证据。在该案件庭审中，双方当庭达成和解协议。后曹娟娟以双方庭审中达成和解协议为由，向法院提出撤诉申请。2018年9月20日，法院下发（2018）吉0291民初581号民事裁定书，裁定准许曹娟娟撤诉。王硕与曹娟娟达成和解协议，后曹娟娟向法院申请撤诉并经人民法院准许的事实，均可证明王硕和人民法院均认可曹娟娟是出借人。二、原审法院调取的案外人李树胜、李泓男的笔录未经质证,不能作为认定案件基本事实的根据。三、曹娟娟陈述了借款的经过。本案起因于曹娟娟的朋友潘海峰向学生借款。潘海峰曾经在学校附近开手机店，出售和修理手机。潘海峰在与学生联系的过程中，有学生向潘海峰借款。后来，潘海峰问曹娟娟是否可以借款给学生。曹娟娟答应后，潘海峰将曹娟娟的电话号码提供给需要借款的学生。学生给曹娟娟打电话向其借款，这就是“要约”;曹娟娟接到要借款的学生的电话，同意借款，双方在电话里约定在“乾元财富”等地见面协商缔约,此既为“承诺”。四、曹娟娟已就借款经过进行了说明并提供证据，一审裁定认为:“曹娟娟无法陈述签订合同的过程，不能证明其是真正的借款人”，无法成立。五、关于曹娟娟出借款项来源和收取还款的去向的问题。原审法院根据曹娟娟出借的款项均来自于案外人李树胜的账户，但曹娟娟曾经说过款项是其父母的；依据出借的每一笔款项均由李树胜存入曹娟娟的银行卡，借款人偿还借款本息存入曹娟娟账户后，又由曹娟娟转入李树胜的银行卡中，认定曹娟娟的陈述自相矛盾是错误的。曹娟娟出借的款项来自其父母，为了确保安全，将款项委托亲属李树胜保管。需要用款时让李树胜将款项转入曹娟娟的账户，曹娟娟收回的款项再转入李树胜的账户。曹娟娟将自己钱款委托亲属李树胜保管的事情，是作为一个公民的“个人隐私”，也是个人的秘密。曹娟娟为保护自己的个人隐私和秘密，对于本案无关的问题拒绝回答或不愿意说清楚，完全是合法的。六、关于曹娟娟向借款人索要借款本息的过程问题。一审裁定依据曹娟娟无法说明向借款人催款的详尽过程，认定其不是真正的出借人是错误的。催收欠款过程以及是否催收欠款不影响债权人主张债权。此问题与出借人的身份没有关系。七、系列案件的裁定书上，明确的写明三位法官组成了合议庭。但案件实际均为周梁玉独任审理。郑东未予答辩。曹娟娟向一审法院起诉请求：判令郑东立即给付欠款本金7300元，借款合同期内利息1971元，逾期利息1314元，合计10,585元。一审法院认为，曹娟娟主张其将涉案钱款借给郑东，但系列案件中到庭借款人对此予以否认，并称不认识曹娟娟，亦未向曹娟娟借款。本案曹娟娟是否与郑东缔结民间借贷合同，直接决定着曹娟娟是否具有要求郑东偿还借款本息的主体资格。若双方间建立了民间借贷合同关系，则曹娟娟可以成为本案的适格原告，具有要求郑东偿还借款本息的权利；否则，曹娟娟无权要求郑东偿还借款本息，不能成为本案的适格原告。就此，一审法院经审查认为，一、从曹娟娟无法陈述其与郑东签订民间借贷合同要约和承诺的过程来看，不能证明其是真正的出借人。曹娟娟在吉林市居住，发生借款时的借款人（包括本案在内的51宗民间借贷案件所谓的借款人）均为在校学生，且多在长春市就读。若曹娟娟与诸被告缔结民间借贷合同关系，需要到长春市借款人所就读的学校或通过其他途径与之进行要约和承诺，但曹娟娟不仅不能说明借款人的自然情况，亦不能说明其在何时、何地、通过何人与诸被告联系并就借款相关事宜进行了磋商，且李辰宇、王硕及刘成博等述称既不认识也从未见过曹娟娟，更未就借款事宜与曹娟娟进行协商。不仅如此，以上借款人在不同时间、不同地点且互不相识的情况下均一致陈述是向乾元财富借的钱，是乾元财富的具体工作人员向其放贷的，其与乾元财富的工作人员就借款事宜进行协商并达成借款协议的。在曹娟娟不能说清其与郑东等人就借款事宜进行缔约的过程，又不能提供证据阐明以上借款人陈述不实的情况下，不能证明其为真正的出借人。二、从曹娟娟无法陈述其与郑东签订民间借贷合同的过程来看，不能证明其是真正的出借人。就签订借款合同的文本是由谁提供的，在何时、何地、当时有何人在场等签订借款合同的详细过程，曹娟娟均以记不清为由无法作出详尽陈述，而李辰宇、王硕及刘成博等均不约而同一致陈述是与乾元财富的具体业务员在各大学附近的乾元财富签订的借款合同（51宗案件的借款合同均为格式合同），刘成博称乾元财富的具体工作人员让其在借款合同上签名时出借人处是空白的等，并不知悉曹娟娟是何时在借款合同上签名的。在曹娟娟不能说明签订借款合同的过程，且并无证据推翻刘成博等人上述陈述的情况下，不能证明其是真正的出借人。三、从曹娟娟关于出借款项来源陈述自相矛盾的情况来看，不能证明其是真正的出借人。在一审法院询问曹娟娟款项来源时，其回答自相矛盾。其在同一份询问笔录中称其所借款项均是向父母借来的，经一审法院查实，出借款项均来自于李树胜账户，曹娟娟作为出借人，竟然对于借款来源陈述相互冲突，且不能自圆其说。在曹娟娟没有提供证据对于其关于出借款项来源的矛盾说辞作出合理解释的情况下，不能证明其为真正的出借人。四、从曹娟娟出借款项的来源和收取还款的去向来看，不能证明其是真正的出借人。从一审法院调取的曹娟娟放贷账户的银行流水看，其出借的每一笔款项均由李树胜存入曹娟娟的银行卡（中信银行账户62XX26），然后由曹娟娟转存给借款人，借款人偿还借款本息又存入曹娟娟账户的，又由曹娟娟转入李树胜的银行卡中。曹娟娟自称李树胜向其借款，若此说成立，应当由李树胜向其偿还借款，而事实却是由曹娟娟将款项转存给李树胜。显然，曹娟娟该陈述是自相矛盾的。在曹娟娟无法提供证据就出借款项和收回款项的流向作出合理说明的情况下，不能证明其是真正的出借人。五、从曹娟娟无法陈述其向借款人索要借款本息的过程来看，不能证明其是真正的出借人。曹娟娟称借款到期后，郑东未能偿还借款本息，其向郑东索要借款本息未果。但曹娟娟却无法叙明其在何时、何地通过何种方式向郑东索要借款本息的过程。而前述借款人详尽陈述了乾元财富具体工作人员，通过向借款人本人及其同学、朋友、父母打电话、发短信或微信等方式索要借款本息。在曹娟娟无法说明催款的详尽过程，且不能提供证据颠覆借款人陈述的情况下，不能证明其为真正的出借人。此外，曹娟娟自称其无职业，一直在家带孩子。从数十件校园贷的表象上看，其以放贷为业。但曹娟娟的陈述与其放贷行为相互抵触。曹娟娟的银行流水中体现出其收回借款的部分款项转入李泓男个人账户，而李泓男是吉林市乾元投资管理有限公司、吉林市乾元商业保理有限公司的法定代表人，是吉林市乾元万鑫股份投资基金合伙企业（有限合伙）股东，曹娟娟称李树胜与李泓男系父子关系，其与此二人又有亲属关系。又加之前述借款人均称出借人是乾元财富（其坐落于吉林市化工学院对面，李泓男称由其公司开设），再结合以上五点，在曹娟娟无法提供证据证明其是真正出借人的情况下，应当认定：曹娟娟在校园贷过程中提供了其个人银行账户，并在借款合同出借人处签名，其只是名义上而不是真正的出借人，亦不是涉案民间借贷合同真正的出借一方当事人（涉案民间借贷纠纷，应由真正的出借人向郑东主张权利），与本案并无直接利害关系，根据《中华人民共和国民事诉讼法》第一百一十九条之规定，曹娟娟不能成为本民间借贷纠纷的适格原告。综上所述，一审法院依照《中华人民共和国民事诉讼法》第一百一十九条、第一百五十四条第一款第三项、《最高人民法院关于适用的解释》第二百零八条第三款规定，裁定：驳回曹娟娟的起诉。本院认为，民间借贷关系形成的前提是双方当事人存在借款合意，法院应当对当事人之间是否存在借款合意、借贷发生的原因、时间、地点、借款来源、支付方式、如何签订借款合同等进行审查，以确认借贷关系是否存在。曹娟娟不能明确说明郑东的自然情况，且对于借款时间、地点、经过及如何签订借款合同陈述前后矛盾，对于出借款项与李树胜向其转账的款项关系陈述亦前后矛盾。因包括本案在内的51件民间借贷纠纷案件的到庭被告表示不认识曹娟娟，且未与其磋商过借贷事宜，在借款合同上乙方（借款人）处签名时甲方（出借人）处空白。合同一式二份又全部由出借人保存，借款人手中并未留存合同。现曹娟娟未能提供充足证据证明其为民间借贷关系的出借人，故无法认定曹娟娟为本案适格原告。根据《最高人民法院关于适用的解释》第二百零九条第二款规定：“立案后发现不符合起诉条件或者属于民事诉讼法第一百二十四条规定情形的，裁定驳回起诉。”一审法院因曹娟娟不是适格原告，在案件变更为普通程序后无需开庭即裁定驳回起诉并无不当。综上所述，曹娟娟的上诉请求不能成立，一审裁定适用法律正确，依照《中华人民共和国民事诉讼法》第一百七十条第一款第一项、第一百七十一条、《最高人民法院关于适用的解释》第二百零九条第二款规定，裁定如下：驳回上诉，维持原裁定。本裁定为终审裁定。审　判　长　　张　英审　判　员　　任宝君代理审判员　　王东竹二〇一九年二月二十一日书　记　员　　曲鹏达,
